form_name,ad_name,full_name,phone_number,email_address,alternate_phone,alternate_email,city_town,budget_range,project_interest,notes_remarks,lead_status,submitted_on
"Sarjapur Plots - Lead Gen","Video Ad Set 1","Amit Verma","+91 9845123456","amit.verma@gmail.com","9876501234","amitv.alt@yahoo.com","Bangalore","50L-70L","Sarjapur Plots","Called twice, interested but wants site visit next weekend. Also asked about EMI options.","Interested","2026-06-01T10:15:00"
"Eden Park Launch Campaign","Carousel Ad","Neha Kulkarni",,"neha.k1990@outlook.com",,,"Pune","1Cr+","Eden Park","Did not pick up call, sent whatsapp message instead",,"01-06-2026 11:30 AM"
"Meridian Tower Enquiry","Lead Form A","","","","","","Hyderabad","",,"Random junk row with no contact info, should be skipped",,"2026-06-01 13:45"
"Varah Swamy Estate","Static Image Ad","Rahul, Priya Sharma","9900112233 / 9900112244","rahul.sharma@gmail.com; priya.sharma@gmail.com",,,"Chennai","30L-50L","Varah Swamy","Joint family enquiry - Rahul is decision maker. Wife Priya also on calls.","Hot lead - follow up urgently","2026-06-02 09:05:12"
"Sarjapur Plots - Lead Gen","Video Ad Set 2","S. Iyer",,,,"iyer.s@rediffmail.com","Mumbai","","Sarjapur Plots","email only submission, no phone given, budget not disclosed yet","Not interested - budget mismatch","2026/06/02"
"Eden Park Launch Campaign","Story Ad","Deepak Nair","09845678901",,,,"Kochi","70L-1Cr","Eden Park","Sale closed! Advance paid, documentation in progress","Converted - Sale Done","02-Jun-2026 16:20"
"Meridian Tower Enquiry","Lead Form B","Firoz Khan","+91-98123-45678","firoz.khan@hotmail.com","+91 87654 32109",,"Delhi","1Cr+","Meridian Tower","Requested brochure via email, will call back after Eid","Follow up after 15 days","2026-06-03T08:00:00Z"
