Lead Details,Contact Info,Where From,Project,Current Status of Lead,Sales Person Comments,Date Added
"Mr. Suresh Babu, works at TCS","Mobile - 9876123450, personal email sbabu.tcs@gmail.com, office mail suresh.babu@tcs.com","Facebook Ad - Sarjapur","Sarjapur Plots","looks like a good lead, following up","Client called back himself, very keen. wants site visit this Sunday along with wife. mentioned budget around 60 lakhs but flexible. secondary number of wife also shared - 9988001122",1st June 2026
"MRS KAVITHA REDDY","kavithareddy88@gmail.com only, no phone number given by client","walk-in enquiry no source","Eden Park","not connected properly yet","tried reaching but only email available, sent intro mail, awaiting response",June 2 2026
"blank test row - ignore","","","","","this row has literally nothing in contact info fields and should be dropped by the system",2026-06-02
"Prakash & Family","Ph: 9765432109 / Alt: 9765432110 / mail: prakash.family@gmail.com","Sarjapur Plots WhatsApp broadcast","Sarjapur Plots","SALE CONFIRMED - booking done","Booking confirmed on 3rd june, token 1 lakh received via UPI, remaining as per payment plan, possession expected by 2029",03-06-2026
"Ms Anjali D'Souza","+91 90000 11111 (whatsapp only pls call after 6pm)","varah swamy hoarding scan QR","Varah Swamy","bad fit - not our target buyer","budget too low, only interested in under 20L, we don't have inventory in that range, marking as rejected",4 June, 2026
"unnamed lead from data source: meridian_tower campaign","no email no phone just a comment: 'someone called on office landline asking about meridian tower, did not leave contact details'","meridian_tower","Meridian Tower","cannot process - no contact detail","should be skipped since no email or mobile captured at all",2026-06-05
"Ramesh Gowda","9900887766","instagram dm","eden_park","good lead, following up eagerly","interested in eden park, will decide by next week, this client has ALL CAPS PREFERENCE for communication, PLEASE CALL BEFORE 10 AM ONLY",06/06/2026
